{
  "schemaVersion": "1.0",
  "moduleId": "cbc_suite_v1",
  "rfProvenance": {
    "rfRunId": "rf_run_20260717_rf_cbc_001_pediatric_cds_establish",
    "rfBundleId": "bundle_20260718_intent_research_20260717_rf_cbc_001",
    "fixturePath": "tests/fixtures/rf-cbc-001/"
  },
  "assertions": [
    {
      "assertionId": "evas_cbc_age_interval_001",
      "rfRunId": "rf_run_20260717_rf_cbc_001_pediatric_cds_establish",
      "rfSourceCardId": "src_20260718_rfcbc001_01",
      "sourceId": "CALIPER2020_HEMATOLOGY_I",
      "rfEvidenceId": "ev_002",
      "rfClaimId": "clm_009",
      "passageId": "psg_f5499c75db74c5f074d33064291a4c4c721be4aaa9df5a236a3b825a1d40a403",
      "locator": {
        "raw": "Abstract — Results",
        "page": null,
        "section": "Abstract — Results",
        "table": null,
        "paragraph": null
      },
      "exactPassage": null,
      "exactPassageSha256": "sha256:f5499c75db74c5f074d33064291a4c4c721be4aaa9df5a236a3b825a1d40a403",
      "displayPolicy": "hash_and_selector_only",
      "claimStatus": "supported",
      "applicability": {
        "ageRange": "birth to <21 years",
        "sex": "both sexes"
      },
      "laboratory": {
        "analyzer": "Beckman Coulter DxH 900",
        "assayMethod": "CLSI EP28-A3c age-partitioning"
      },
      "reviewBy": "2027-07-21"
    },
    {
      "assertionId": "evas_cbc_analyzer_specificity_001",
      "rfRunId": "rf_run_20260717_rf_cbc_001_pediatric_cds_establish",
      "rfSourceCardId": "src_20260718_rfcbc001_10",
      "sourceId": "CALIPER2020_HEMATOLOGY_I",
      "rfEvidenceId": "ev_002",
      "rfClaimId": "clm_026",
      "passageId": "psg_6a7d1311f9abd40d23b88db00c36c982b5f5d66a7ac997cd49c3ebe47fa51894",
      "locator": {
        "raw": "Abstract — Methods; Table 1 caption",
        "page": null,
        "section": "Abstract — Methods; Table 1 caption",
        "table": "Table 1",
        "paragraph": null
      },
      "exactPassage": null,
      "exactPassageSha256": "sha256:6a7d1311f9abd40d23b88db00c36c982b5f5d66a7ac997cd49c3ebe47fa51894",
      "displayPolicy": "hash_and_selector_only",
      "claimStatus": "supported",
      "applicability": {
        "ageRange": "birth to <21 years",
        "sex": "both sexes"
      },
      "laboratory": {
        "analyzer": "Beckman Coulter DxH 900",
        "assayMethod": "Not portable to other analyzers without transference/verification"
      },
      "reviewBy": "2027-07-21"
    },
    {
      "assertionId": "evas_cbc_analyzer_specificity_002",
      "rfRunId": "rf_run_20260717_rf_cbc_001_pediatric_cds_establish",
      "rfSourceCardId": "src_20260718_rfcbc001_02",
      "sourceId": "CALIPER2023_MINDRAY_79PARAM",
      "rfEvidenceId": "ev_006",
      "rfClaimId": "clm_062",
      "passageId": "psg_f9741aa6b4c6846b929ef80c5fa56c897152f181865f82c52d78b5cd16b02f40",
      "locator": {
        "raw": "Abstract — Methods sentence 2 / Title",
        "page": null,
        "section": "Abstract — Methods sentence 2 / Title",
        "table": null,
        "paragraph": null
      },
      "exactPassage": null,
      "exactPassageSha256": "sha256:f9741aa6b4c6846b929ef80c5fa56c897152f181865f82c52d78b5cd16b02f40",
      "displayPolicy": "hash_and_selector_only",
      "claimStatus": "supported",
      "applicability": {
        "ageRange": null,
        "sex": null
      },
      "laboratory": {
        "analyzer": "Mindray BC-6800Plus",
        "assayMethod": "79-parameter hematology panel; instrument-dependent"
      },
      "reviewBy": "2027-07-21"
    },
    {
      "assertionId": "evas_cbc_benign_neutropenia_differential_001",
      "rfRunId": "rf_run_20260717_rf_cbc_001_pediatric_cds_establish",
      "rfSourceCardId": "src_20260718_rfcbc001_11",
      "sourceId": "JPEDS2023_DUFFY_NULL_NEUTROPENIA",
      "rfEvidenceId": "ev_001",
      "rfClaimId": "clm_039",
      "passageId": "psg_4c3f13fb9c3f701f2fc5e91eb83f1dba9f90b2c55b39f0e8673246f2bf876699",
      "locator": {
        "raw": "Abstract (first sentence)",
        "page": null,
        "section": "Abstract (first sentence)",
        "table": null,
        "paragraph": null
      },
      "exactPassage": null,
      "exactPassageSha256": "sha256:4c3f13fb9c3f701f2fc5e91eb83f1dba9f90b2c55b39f0e8673246f2bf876699",
      "displayPolicy": "hash_and_selector_only",
      "claimStatus": "supported",
      "applicability": {
        "ageRange": "pediatric referral cohort",
        "sex": "mixed sex"
      },
      "laboratory": {
        "analyzer": null,
        "assayMethod": "Referral-cohort proportion; Duffy phenotype/genotype ascertainment"
      },
      "reviewBy": "2027-07-21"
    },
    {
      "assertionId": "evas_cbc_benign_neutropenia_differential_002",
      "rfRunId": "rf_run_20260717_rf_cbc_001_pediatric_cds_establish",
      "rfSourceCardId": "src_20260718_rfcbc001_11",
      "sourceId": "JPEDS2023_DUFFY_NULL_NEUTROPENIA",
      "rfEvidenceId": "ev_005",
      "rfClaimId": "clm_043",
      "passageId": "psg_98bcac91cca14bc0ff9d601b26ac09358b42ff4c80c0caa661a421815804f7f4",
      "locator": {
        "raw": "Abstract (second sentence)",
        "page": null,
        "section": "Abstract (second sentence)",
        "table": null,
        "paragraph": null
      },
      "exactPassage": null,
      "exactPassageSha256": "sha256:98bcac91cca14bc0ff9d601b26ac09358b42ff4c80c0caa661a421815804f7f4",
      "displayPolicy": "hash_and_selector_only",
      "claimStatus": "supported",
      "applicability": {
        "ageRange": "pediatric, no recurrent/frequent/serious infection",
        "sex": "any sex"
      },
      "laboratory": {
        "analyzer": null,
        "assayMethod": "Clinical discriminator + Duffy typing availability; not a numeric assay threshold"
      },
      "reviewBy": "2027-07-21"
    },
    {
      "assertionId": "evas_cbc_benign_neutropenia_differential_003",
      "rfRunId": "rf_run_20260717_rf_cbc_001_pediatric_cds_establish",
      "rfSourceCardId": "src_20260718_rfcbc001_11",
      "sourceId": "JPEDS2023_DUFFY_NULL_NEUTROPENIA",
      "rfEvidenceId": "ev_002",
      "rfClaimId": "clm_040",
      "passageId": "psg_da64b3368c0e927d170e5fd10b666cb8a2aec6d83bd8f2136eb1b2ba4d4d93a4",
      "locator": {
        "raw": "Abstract (first sentence)",
        "page": null,
        "section": "Abstract (first sentence)",
        "table": null,
        "paragraph": null
      },
      "exactPassage": null,
      "exactPassageSha256": "sha256:da64b3368c0e927d170e5fd10b666cb8a2aec6d83bd8f2136eb1b2ba4d4d93a4",
      "displayPolicy": "hash_and_selector_only",
      "claimStatus": "supported",
      "applicability": {
        "ageRange": "pediatric referral subgroup (Yemeni)",
        "sex": "mixed sex"
      },
      "laboratory": {
        "analyzer": null,
        "assayMethod": "Subgroup proportion of Duffy-null-associated neutropenia"
      },
      "reviewBy": "2027-07-21"
    },
    {
      "assertionId": "evas_cbc_benign_neutropenia_differential_004",
      "rfRunId": "rf_run_20260717_rf_cbc_001_pediatric_cds_establish",
      "rfSourceCardId": "src_20260718_rfcbc001_11",
      "sourceId": "JPEDS2023_DUFFY_NULL_NEUTROPENIA",
      "rfEvidenceId": "ev_003",
      "rfClaimId": "clm_041",
      "passageId": "psg_da64b3368c0e927d170e5fd10b666cb8a2aec6d83bd8f2136eb1b2ba4d4d93a4",
      "locator": {
        "raw": "Abstract (first sentence)",
        "page": null,
        "section": "Abstract (first sentence)",
        "table": null,
        "paragraph": null
      },
      "exactPassage": null,
      "exactPassageSha256": "sha256:da64b3368c0e927d170e5fd10b666cb8a2aec6d83bd8f2136eb1b2ba4d4d93a4",
      "displayPolicy": "hash_and_selector_only",
      "claimStatus": "supported",
      "applicability": {
        "ageRange": "pediatric referral subgroup (African American)",
        "sex": "mixed sex"
      },
      "laboratory": {
        "analyzer": null,
        "assayMethod": "Subgroup proportion"
      },
      "reviewBy": "2027-07-21"
    },
    {
      "assertionId": "evas_cbc_benign_neutropenia_differential_005",
      "rfRunId": "rf_run_20260717_rf_cbc_001_pediatric_cds_establish",
      "rfSourceCardId": "src_20260718_rfcbc001_05",
      "sourceId": "PEDS2020_ISOLATED_NEUTROPENIA_OUTCOMES",
      "rfEvidenceId": "ev_006",
      "rfClaimId": "clm_074",
      "passageId": "psg_e88b86bd01df9bef70f1025960f613a1aba5d1deafa5ad12c634774de1d8f734",
      "locator": {
        "raw": "Abstract — Results (race-associated persistence)",
        "page": null,
        "section": "Abstract — Results (race-associated persistence)",
        "table": null,
        "paragraph": null
      },
      "exactPassage": null,
      "exactPassageSha256": "sha256:e88b86bd01df9bef70f1025960f613a1aba5d1deafa5ad12c634774de1d8f734",
      "displayPolicy": "hash_and_selector_only",
      "claimStatus": "supported",
      "applicability": {
        "ageRange": "newborn through adolescent",
        "sex": "both sexes"
      },
      "laboratory": {
        "analyzer": null,
        "assayMethod": "Odds ratio on persistence, not an assay threshold"
      },
      "reviewBy": "2027-07-21"
    },
    {
      "assertionId": "evas_cbc_caliper_dxh900_intervals_001",
      "rfRunId": "rf_run_20260717_rf_cbc_001_pediatric_cds_establish",
      "rfSourceCardId": "src_20260718_rfcbc001_01",
      "sourceId": "CALIPER2020_HEMATOLOGY_I",
      "rfEvidenceId": "ev_004",
      "rfClaimId": "clm_011",
      "passageId": "psg_de59d84d0b09e9e7863bc79e0823cc75ce240d58e1d2dd876a25a886d768b09a",
      "locator": {
        "raw": "Abstract — Methods / Conclusions",
        "page": null,
        "section": "Abstract — Methods / Conclusions",
        "table": null,
        "paragraph": null
      },
      "exactPassage": null,
      "exactPassageSha256": "sha256:de59d84d0b09e9e7863bc79e0823cc75ce240d58e1d2dd876a25a886d768b09a",
      "displayPolicy": "hash_and_selector_only",
      "claimStatus": "supported",
      "applicability": {